{
  "acquisition": {
    "bitrates_bps": [
      500000
    ],
    "capture_duration_seconds": 86.441,
    "estimated_observed_frames": 46722,
    "estimated_observed_rate_fps": 540.426,
    "extended_identifier_records": 0,
    "gateways": 1,
    "listen_only_records": 3192,
    "records": 3192,
    "remote_request_records": 0,
    "retained_record_rate_fps": 36.927,
    "sequence_coverage": 0.068319,
    "sessions": 7,
    "standard_identifier_records": 3192,
    "unique_identifiers": 17
  },
  "authority": "Acquisition facts and raw statistics only. No CAN identifier, field, unit, scale, vehicle subsystem, or health meaning is accepted by this report. Source-sequence coverage describes retained evidence density; it is not a dropped-frame counter. Gateway TWAI, observer-queue, and persistence counters are required to attribute loss.",
  "checksum_candidates": [
    {
      "checked": 387,
      "identifier": "0x2C1",
      "match_rate": 1.0,
      "matches": 387,
      "status": "DISCOVERY_CANDIDATE"
    },
    {
      "checked": 410,
      "identifier": "0x025",
      "match_rate": 1.0,
      "matches": 410,
      "status": "DISCOVERY_CANDIDATE"
    },
    {
      "checked": 405,
      "identifier": "0x2C4",
      "match_rate": 1.0,
      "matches": 405,
      "status": "DISCOVERY_CANDIDATE"
    },
    {
      "checked": 419,
      "identifier": "0x023",
      "match_rate": 1.0,
      "matches": 419,
      "status": "DISCOVERY_CANDIDATE"
    },
    {
      "checked": 395,
      "identifier": "0x022",
      "match_rate": 1.0,
      "matches": 395,
      "status": "DISCOVERY_CANDIDATE"
    },
    {
      "checked": 384,
      "identifier": "0x2D0",
      "match_rate": 1.0,
      "matches": 384,
      "status": "DISCOVERY_CANDIDATE"
    },
    {
      "checked": 83,
      "identifier": "0x420",
      "match_rate": 1.0,
      "matches": 83,
      "status": "DISCOVERY_CANDIDATE"
    },
    {
      "checked": 88,
      "identifier": "0x223",
      "match_rate": 1.0,
      "matches": 88,
      "status": "DISCOVERY_CANDIDATE"
    }
  ],
  "contract": "can.discovery.report",
  "contract_version": "1.0.0",
  "display_policy": {
    "blocked_until_correlated": [
      "RPM, speed, gear, throttle, steering, brake, temperature, or pressure labels",
      "normal/abnormal thresholds and vehicle-health conclusions"
    ],
    "candidate_only": [
      "checksum family matches",
      "raw word correlations and ratios",
      "repeated-channel agreement",
      "counter, signedness, scale, offset, and vehicle-signal hypotheses",
      "receive-loss attribution when gateway health counters are absent from the input"
    ],
    "proven_now": [
      "capture/session/source identity",
      "listen-only, identifier-format, RTR, bitrate, and DLC evidence",
      "retained records, identifier population, raw payloads, and raw byte ranges",
      "sequence-derived observed-rate estimate and explicit retained coverage",
      "retained coverage is intentional sampling density, not proof of receive loss"
    ]
  },
  "identifier_activity": [
    {
      "byte_ranges": [
        {
          "byte": 0,
          "maximum": 8,
          "minimum": 0
        },
        {
          "byte": 1,
          "maximum": 19,
          "minimum": 0
        },
        {
          "byte": 2,
          "maximum": 255,
          "minimum": 0
        },
        {
          "byte": 3,
          "maximum": 255,
          "minimum": 0
        },
        {
          "byte": 4,
          "maximum": 255,
          "minimum": 0
        },
        {
          "byte": 5,
          "maximum": 255,
          "minimum": 192
        },
        {
          "byte": 6,
          "maximum": 0,
          "minimum": 0
        },
        {
          "byte": 7,
          "maximum": 255,
          "minimum": 0
        }
      ],
      "checksum_candidate": {
        "algorithm": "toyota-additive-id-dlc-payload-v0",
        "candidate": true,
        "checked": 387,
        "match_rate": 1.0,
        "matches": 387,
        "status": "DISCOVERY_CANDIDATE"
      },
      "data_lengths": [
        8
      ],
      "dynamic_byte_count": 7,
      "dynamic_byte_positions": [
        0,
        1,
        2,
        3,
        4,
        5,
        7
      ],
      "extended": false,
      "first_big_endian_word": {
        "bit_range": "0:16",
        "byte_order": "BIG_ENDIAN",
        "maximum": 2067,
        "mean": 2035.186,
        "minimum": 0,
        "standard_deviation": 207.997,
        "status": "DISCOVERY_CANDIDATE"
      },
      "identifier": "0x2C1",
      "identifier_value": 705,
      "payload_change_rate": 1.0,
      "records": 387,
      "sessions": 7,
      "status": "DISCOVERY_CANDIDATE",
      "unique_payloads": 380
    },
    {
      "byte_ranges": [
        {
          "byte": 0,
          "maximum": 15,
          "minimum": 0
        },
        {
          "byte": 1,
          "maximum": 244,
          "minimum": 11
        },
        {
          "byte": 2,
          "maximum": 0,
          "minimum": 0
        },
        {
          "byte": 3,
          "maximum": 13,
          "minimum": 13
        },
        {
          "byte": 4,
          "maximum": 255,
          "minimum": 115
        },
        {
          "byte": 5,
          "maximum": 255,
          "minimum": 115
        },
        {
          "byte": 6,
          "maximum": 255,
          "minimum": 115
        },
        {
          "byte": 7,
          "maximum": 224,
          "minimum": 66
        }
      ],
      "checksum_candidate": {
        "algorithm": "toyota-additive-id-dlc-payload-v0",
        "candidate": true,
        "checked": 410,
        "match_rate": 1.0,
        "matches": 410,
        "status": "DISCOVERY_CANDIDATE"
      },
      "data_lengths": [
        8
      ],
      "dynamic_byte_count": 6,
      "dynamic_byte_positions": [
        0,
        1,
        4,
        5,
        6,
        7
      ],
      "extended": false,
      "first_big_endian_word": {
        "bit_range": "0:16",
        "byte_order": "BIG_ENDIAN",
        "maximum": 4084,
        "mean": 459.568,
        "minimum": 11,
        "standard_deviation": 1240.652,
        "status": "DISCOVERY_CANDIDATE"
      },
      "identifier": "0x025",
      "identifier_value": 37,
      "payload_change_rate": 0.997519,
      "records": 410,
      "sessions": 7,
      "status": "DISCOVERY_CANDIDATE",
      "unique_payloads": 42
    },
    {
      "byte_ranges": [
        {
          "byte": 0,
          "maximum": 7,
          "minimum": 0
        },
        {
          "byte": 1,
          "maximum": 255,
          "minimum": 0
        },
        {
          "byte": 2,
          "maximum": 0,
          "minimum": 0
        },
        {
          "byte": 3,
          "maximum": 50,
          "minimum": 30
        },
        {
          "byte": 4,
          "maximum": 64,
          "minimum": 0
        },
        {
          "byte": 5,
          "maximum": 128,
          "minimum": 128
        },
        {
          "byte": 6,
          "maximum": 18,
          "minimum": 18
        },
        {
          "byte": 7,
          "maximum": 253,
          "minimum": 1
        }
      ],
      "checksum_candidate": {
        "algorithm": "toyota-additive-id-dlc-payload-v0",
        "candidate": true,
        "checked": 405,
        "match_rate": 1.0,
        "matches": 405,
        "status": "DISCOVERY_CANDIDATE"
      },
      "data_lengths": [
        8
      ],
      "dynamic_byte_count": 5,
      "dynamic_byte_positions": [
        0,
        1,
        3,
        4,
        7
      ],
      "extended": false,
      "first_big_endian_word": {
        "bit_range": "0:16",
        "byte_order": "BIG_ENDIAN",
        "maximum": 1867,
        "mean": 1280.696,
        "minimum": 0,
        "standard_deviation": 313.654,
        "status": "DISCOVERY_CANDIDATE"
      },
      "identifier": "0x2C4",
      "identifier_value": 708,
      "payload_change_rate": 1.0,
      "records": 405,
      "sessions": 7,
      "status": "DISCOVERY_CANDIDATE",
      "unique_payloads": 359
    },
    {
      "byte_ranges": [
        {
          "byte": 0,
          "maximum": 2,
          "minimum": 1
        },
        {
          "byte": 1,
          "maximum": 255,
          "minimum": 0
        },
        {
          "byte": 2,
          "maximum": 2,
          "minimum": 2
        },
        {
          "byte": 3,
          "maximum": 28,
          "minimum": 8
        },
        {
          "byte": 4,
          "maximum": 56,
          "minimum": 0
        },
        {
          "byte": 5,
          "maximum": 0,
          "minimum": 0
        },
        {
          "byte": 6,
          "maximum": 139,
          "minimum": 54
        }
      ],
      "checksum_candidate": {
        "algorithm": "toyota-additive-id-dlc-payload-v0",
        "candidate": true,
        "checked": 419,
        "match_rate": 1.0,
        "matches": 419,
        "status": "DISCOVERY_CANDIDATE"
      },
      "data_lengths": [
        7
      ],
      "dynamic_byte_count": 5,
      "dynamic_byte_positions": [
        0,
        1,
        3,
        4,
        6
      ],
      "extended": false,
      "first_big_endian_word": {
        "bit_range": "0:16",
        "byte_order": "BIG_ENDIAN",
        "maximum": 529,
        "mean": 511.193,
        "minimum": 505,
        "standard_deviation": 1.809,
        "status": "DISCOVERY_CANDIDATE"
      },
      "identifier": "0x023",
      "identifier_value": 35,
      "payload_change_rate": 1.0,
      "records": 419,
      "sessions": 7,
      "status": "DISCOVERY_CANDIDATE",
      "unique_payloads": 65
    },
    {
      "byte_ranges": [
        {
          "byte": 0,
          "maximum": 1,
          "minimum": 1
        },
        {
          "byte": 1,
          "maximum": 254,
          "minimum": 103
        },
        {
          "byte": 2,
          "maximum": 2,
          "minimum": 1
        },